packages/amd-aiter/amd_aiter-0.1.7.post2.dev18.tar.gz/amd_aiter-0.1.7.post2.dev18/aiter/ops/triton/configs/gemm/MI350X-GEMM-A16W16-N=128-K=2880.json
{
  "M_LEQ_4": {
    "BLOCK_SIZE_M": 1,
    "BLOCK_SIZE_N": 4,
    "BLOCK_SIZE_K": 512,
    "GROUP_SIZE_M": 1,
    "waves_per_eu": 4,
    "matrix_instr_nonkdim": 16,
    "cache_modifier": null,
    "num_warps": 4,
    "num_stages": 2
  },
  "M_LEQ_8": {
    "BLOCK_SIZE_M": 1,
    "BLOCK_SIZE_N": 4,
    "BLOCK_SIZE_K": 512,
    "GROUP_SIZE_M": 1,
    "waves_per_eu": 1,
    "matrix_instr_nonkdim": 16,
    "cache_modifier": null,
    "num_warps": 4,
    "num_stages": 2
  },
  "M_LEQ_16": {
    "BLOCK_SIZE_M": 1,
    "BLOCK_SIZE_N": 4,
    "BLOCK_SIZE_K": 512,
    "GROUP_SIZE_M": 1,
    "waves_per_eu": 1,
    "matrix_instr_nonkdim": 16,
    "cache_modifier": null,
    "num_warps": 4,
    "num_stages": 2
  },
  "M_LEQ_32": {
    "BLOCK_SIZE_M": 16,
    "BLOCK_SIZE_N": 16,
    "BLOCK_SIZE_K": 512,
    "GROUP_SIZE_M": 1,
    "waves_per_eu": 4,
    "matrix_instr_nonkdim": 16,
    "cache_modifier": null,
    "num_warps": 8,
    "num_stages": 2
  },
  "M_LEQ_64": {
    "BLOCK_SIZE_M": 32,
    "BLOCK_SIZE_N": 32,
    "BLOCK_SIZE_K": 512,
    "GROUP_SIZE_M": 1,
    "waves_per_eu": 2,
    "matrix_instr_nonkdim": 16,
    "cache_modifier": null,
    "num_warps": 8,
    "num_stages": 2
  },
  "M_LEQ_128": {
    "BLOCK_SIZE_M": 16,
    "BLOCK_SIZE_N": 16,
    "BLOCK_SIZE_K": 512,
    "GROUP_SIZE_M": 1,
    "waves_per_eu": 4,
    "matrix_instr_nonkdim": 16,
    "cache_modifier": null,
    "num_warps": 8,
    "num_stages": 2
  },
  "M_LEQ_256": {
    "BLOCK_SIZE_M": 16,
    "BLOCK_SIZE_N": 16,
    "BLOCK_SIZE_K": 512,
    "GROUP_SIZE_M": 1,
    "waves_per_eu": 2,
    "matrix_instr_nonkdim": 16,
    "cache_modifier": null,
    "num_warps": 8,
    "num_stages": 2
  },
  "M_LEQ_512": {
    "BLOCK_SIZE_M": 16,
    "BLOCK_SIZE_N": 16,
    "BLOCK_SIZE_K": 512,
    "GROUP_SIZE_M": 1,
    "waves_per_eu": 1,
    "matrix_instr_nonkdim": 16,
    "cache_modifier": null,
    "num_warps": 8,
    "num_stages": 2
  },
  "M_LEQ_1024": {
    "BLOCK_SIZE_M": 32,
    "BLOCK_SIZE_N": 16,
    "BLOCK_SIZE_K": 512,
    "GROUP_SIZE_M": 1,
    "waves_per_eu": 2,
    "matrix_instr_nonkdim": 16,
    "cache_modifier": null,
    "num_warps": 8,
    "num_stages": 2
  },
  "M_LEQ_2048": {
    "BLOCK_SIZE_M": 32,
    "BLOCK_SIZE_N": 32,
    "BLOCK_SIZE_K": 512,
    "GROUP_SIZE_M": 1,
    "waves_per_eu": 2,
    "matrix_instr_nonkdim": 16,
    "cache_modifier": null,
    "num_warps": 8,
    "num_stages": 2
  },
  "M_LEQ_4096": {
    "BLOCK_SIZE_M": 32,
    "BLOCK_SIZE_N": 32,
    "BLOCK_SIZE_K": 512,
    "GROUP_SIZE_M": 1,
    "waves_per_eu": 2,
    "matrix_instr_nonkdim": 16,
    "cache_modifier": null,
    "num_warps": 8,
    "num_stages": 2
  },
  "M_LEQ_8192": {
    "BLOCK_SIZE_M": 128,
    "BLOCK_SIZE_N": 32,
    "BLOCK_SIZE_K": 256,
    "GROUP_SIZE_M": 4,
    "waves_per_eu": 1,
    "matrix_instr_nonkdim": 16,
    "cache_modifier": ".cg",
    "num_warps": 8,
    "num_stages": 2
  },
  "any": {
    "BLOCK_SIZE_M": 128,
    "BLOCK_SIZE_N": 32,
    "BLOCK_SIZE_K": 256,
    "GROUP_SIZE_M": 4,
    "waves_per_eu": 1,
    "matrix_instr_nonkdim": 16,
    "cache_modifier": ".cg",
    "num_warps": 8,
    "num_stages": 2
  }
}