packages/amd-aiter/amd_aiter-0.1.7.post2.dev18.tar.gz/amd_aiter-0.1.7.post2.dev18/aiter/ops/triton/configs/gemm/MI350X-GEMM-A8W8_BLOCKSCALE-N=512-K=7168.json
{
  "small": {
    "BLOCK_SIZE_M": 16,
    "BLOCK_SIZE_N": 16,
    "BLOCK_SIZE_K": 128,
    "GROUP_SIZE_M": 4,
    "num_warps": 2,
    "num_stages": 2,
    "waves_per_eu": 2,
    "matrix_instr_nonkdim": 16,
    "cache_modifier": ".cg",
    "NUM_KSPLIT": 14
  },
  "medium_M32": {
    "BLOCK_SIZE_M": 32,
    "BLOCK_SIZE_N": 16,
    "BLOCK_SIZE_K": 128,
    "GROUP_SIZE_M": 1,
    "num_warps": 2,
    "num_stages": 2,
    "waves_per_eu": 4,
    "matrix_instr_nonkdim": 16,
    "cache_modifier": ".cg",
    "NUM_KSPLIT": 14
  },
  "medium_M64": {
    "BLOCK_SIZE_M": 32,
    "BLOCK_SIZE_N": 16,
    "BLOCK_SIZE_K": 128,
    "GROUP_SIZE_M": 1,
    "num_warps": 2,
    "num_stages": 2,
    "waves_per_eu": 4,
    "matrix_instr_nonkdim": 16,
    "cache_modifier": ".cg",
    "NUM_KSPLIT": 14
  },
  "medium_M128": {
    "BLOCK_SIZE_M": 32,
    "BLOCK_SIZE_N": 16,
    "BLOCK_SIZE_K": 128,
    "GROUP_SIZE_M": 1,
    "num_warps": 2,
    "num_stages": 2,
    "waves_per_eu": 2,
    "matrix_instr_nonkdim": 16,
    "cache_modifier": ".cg",
    "NUM_KSPLIT": 7
  },
  "any": {
    "BLOCK_SIZE_M": 128,
    "BLOCK_SIZE_N": 32,
    "BLOCK_SIZE_K": 128,
    "GROUP_SIZE_M": 1,
    "num_warps": 2,
    "num_stages": 2,
    "waves_per_eu": 2,
    "matrix_instr_nonkdim": 16,
    "cache_modifier": ".cg",
    "NUM_KSPLIT": 1
  }
}
