packages/amd-aiter/amd_aiter-0.1.7.post2.dev18-py3-none-any.whl/aiter/configs/asm_a8w8_gemm.csv
M,N,K,bias,outdtype,splitK,us
128,1280,8192,True,torch.bfloat16,0,13.85
192,128,5120,True,torch.bfloat16,8,18.90
192,1280,8192,True,torch.bfloat16,3,13.90
192,1280,1024,True,torch.bfloat16,4,13.90
192,1536,1024,True,torch.bfloat16,4,13.90
256,1280,8192,True,torch.bfloat16,3,25.54
320,1280,8192,True,torch.bfloat16,3,25.56
512,1280,8192,True,torch.bfloat16,3,48.06
1024,1280,8192,True,torch.bfloat16,3,94.45
2048,1280,8192,True,torch.bfloat16,3,186.90
4096,1280,8192,True,torch.bfloat16,3,371.85
8192,1280,8192,True,torch.bfloat16,3,742.90
16384,1280,8192,True,torch.bfloat16,3,1483.54
128,8192,1024,True,torch.bfloat16,4,12.6
192,8192,1024,True,torch.bfloat16,1,12.70
256,8192,1024,True,torch.bfloat16,4,23.80
320,8192,1024,True,torch.bfloat16,4,23.82
512,8192,1024,True,torch.bfloat16,4,44.61
1024,8192,1024,True,torch.bfloat16,4,76.33
2048,8192,1024,True,torch.bfloat16,4,140.05
4096,8192,1024,True,torch.bfloat16,4,277.80
8192,8192,1024,True,torch.bfloat16,4,552.69
16384,8192,1024,True,torch.bfloat16,4,1095.12
64,1536,5120,True,torch.bfloat16,4,1483.54
80,1536,5120,True,torch.bfloat16,4,1483.54
128,1536,5120,True,torch.bfloat16,4,1483.54 
150,1536,5120,True,torch.bfloat16,4,1483.54 
192,1536,5120,True,torch.bfloat16,8,1483.54 
220,1536,5120,True,torch.bfloat16,4,1483.54
256,1536,5120,True,torch.bfloat16,4,1483.54
384,1536,5120,True,torch.bfloat16,4,1483.54 
448,1536,5120,True,torch.bfloat16,4,1483.54 
512,1536,5120,True,torch.bfloat16,4,1483.54
192,5120,1280,True,torch.bfloat16,2,12.70