packages/amd-aiter/amd_aiter-0.1.7.post2.dev18.tar.gz/amd_aiter-0.1.7.post2.dev18/aiter/configs/model_configs/a8w8_blockscale_tuned_gemm_ds_v3.csv
cu_num,M,N,K,kernelId,splitK,us,kernelName,tflops,bw,errRatio
256,1,2112,7168,8,0,23.1423,a8w8_blockscale_1x128x128_256x16x64x256_16x16_16x16_16x16x1_16x16x1_1x16x1x16_4_1x1_intrawave_v1,1.31,654.65,0.0
256,2,2112,7168,8,0,23.1821,a8w8_blockscale_1x128x128_256x16x64x256_16x16_16x16_16x16x1_16x16x1_1x16x1x16_4_1x1_intrawave_v1,2.61,654.02,0.0
256,4,2112,7168,8,0,23.0544,a8w8_blockscale_1x128x128_256x16x64x256_16x16_16x16_16x16x1_16x16x1_1x16x1x16_4_1x1_intrawave_v1,5.25,658.63,0.0
256,8,2112,7168,8,0,23.2634,a8w8_blockscale_1x128x128_256x16x64x256_16x16_16x16_16x16x1_16x16x1_1x16x1x16_4_1x1_intrawave_v1,10.41,654.67,0.0
256,16,2112,7168,8,0,20.2497,a8w8_blockscale_1x128x128_256x16x64x256_16x16_16x16_16x16x1_16x16x1_1x16x1x16_4_1x1_intrawave_v1,23.92,756.61,0.0
256,32,2112,7168,8,0,20.0548,a8w8_blockscale_1x128x128_256x16x64x256_16x16_16x16_16x16x1_16x16x1_1x16x1x16_4_1x1_intrawave_v1,48.31,773.05,0.0
256,64,2112,7168,8,0,19.8696,a8w8_blockscale_1x128x128_256x16x64x256_16x16_16x16_16x16x1_16x16x1_1x16x1x16_4_1x1_intrawave_v1,97.52,798.6,0.0
256,128,2112,7168,8,0,20.2426,a8w8_blockscale_1x128x128_256x16x64x256_16x16_16x16_16x16x1_16x16x1_1x16x1x16_4_1x1_intrawave_v1,191.45,819.9,0.0
256,256,2112,7168,18,0,22.1462,a8w8_blockscale_1x128x128_256x64x64x256_16x16_32x32_16x16x1_16x16x1_1x32x1x8_8_1x1_intrawave_v1,350.0,815.27,0.0
256,512,2112,7168,18,0,29.0228,a8w8_blockscale_1x128x128_256x64x64x256_16x16_32x32_16x16x1_16x16x1_1x32x1x8_8_1x1_intrawave_v1,534.14,722.59,0.0
256,1024,2112,7168,18,0,44.836,a8w8_blockscale_1x128x128_256x64x64x256_16x16_32x32_16x16x1_16x16x1_1x32x1x8_8_1x1_intrawave_v1,691.5,597.83,0.0
256,2048,2112,7168,18,0,74.5268,a8w8_blockscale_1x128x128_256x64x64x256_16x16_32x32_16x16x1_16x16x1_1x32x1x8_8_1x1_intrawave_v1,832.03,516.19,0.0
256,4096,2112,7168,0,0,124.1349,a8w8_blockscale_1x128x128_256x128x128x128_16x16_32x32_8x32x1_8x32x1_1x32x1x8_8_1x1_intrawave_v3,999.05,497.85,0.0
256,8192,2112,7168,0,0,198.3448,a8w8_blockscale_1x128x128_256x128x128x128_16x16_32x32_8x32x1_8x32x1_1x32x1x8_8_1x1_intrawave_v3,1250.52,546.84,0.0
256,16384,2112,7168,0,0,351.5932,a8w8_blockscale_1x128x128_256x128x128x128_16x16_32x32_8x32x1_8x32x1_1x32x1x8_8_1x1_intrawave_v3,1410.92,573.92,0.0
256,32768,2112,7168,0,0,706.8872,a8w8_blockscale_1x128x128_256x128x128x128_16x16_32x32_8x32x1_8x32x1_1x32x1x8_8_1x1_intrawave_v3,1403.53,549.5,0.0
256,1,3072,1536,8,0,7.4103,a8w8_blockscale_1x128x128_256x16x64x256_16x16_16x16_16x16x1_16x16x1_1x16x1x16_4_1x1_intrawave_v1,1.27,637.8,0.0
256,2,3072,1536,8,0,7.4266,a8w8_blockscale_1x128x128_256x16x64x256_16x16_16x16_16x16x1_16x16x1_1x16x1x16_4_1x1_intrawave_v1,2.54,637.43,0.0
256,4,3072,1536,13,0,7.8966,a8w8_blockscale_1x128x128_256x32x64x256_16x16_16x16_16x16x1_16x16x1_1x32x1x8_8_2x1_intrawave_v1,4.78,601.44,0.0
256,8,3072,1536,18,0,7.9267,a8w8_blockscale_1x128x128_256x64x64x256_16x16_32x32_16x16x1_16x16x1_1x32x1x8_8_1x1_intrawave_v1,9.52,603.03,0.0
256,16,3072,1536,8,0,7.4157,a8w8_blockscale_1x128x128_256x16x64x256_16x16_16x16_16x16x1_16x16x1_1x16x1x16_4_1x1_intrawave_v1,20.36,652.87,0.0
256,32,3072,1536,8,0,7.0426,a8w8_blockscale_1x128x128_256x16x64x256_16x16_16x16_16x16x1_16x16x1_1x16x1x16_4_1x1_intrawave_v1,42.88,704.9,0.0
256,64,3072,1536,8,0,7.5522,a8w8_blockscale_1x128x128_256x16x64x256_16x16_16x16_16x16x1_16x16x1_1x16x1x16_4_1x1_intrawave_v1,79.97,689.88,0.0
256,128,3072,1536,8,0,8.1319,a8w8_blockscale_1x128x128_256x16x64x256_16x16_16x16_16x16x1_16x16x1_1x16x1x16_4_1x1_intrawave_v1,148.55,701.14,0.0
256,256,3072,1536,18,0,7.6382,a8w8_blockscale_1x128x128_256x64x64x256_16x16_32x32_16x16x1_16x16x1_1x32x1x8_8_1x1_intrawave_v1,316.29,875.16,0.0
256,512,3072,1536,18,0,10.6592,a8w8_blockscale_1x128x128_256x64x64x256_16x16_32x32_16x16x1_16x16x1_1x32x1x8_8_1x1_intrawave_v1,453.3,811.58,0.0
256,1024,3072,1536,18,0,15.1443,a8w8_blockscale_1x128x128_256x64x64x256_16x16_32x32_16x16x1_16x16x1_1x32x1x8_8_1x1_intrawave_v1,638.11,830.87,0.0
256,2048,3072,1536,2,0,23.8432,a8w8_blockscale_1x128x128_256x64x128x128_16x16_32x32_8x32x1_8x32x1_1x32x1x8_8_1x1_intrawave_v3,810.6,857.57,0.0
256,4096,3072,1536,0,0,37.7108,a8w8_blockscale_1x128x128_256x128x128x128_16x16_32x32_8x32x1_8x32x1_1x32x1x8_8_1x1_intrawave_v3,1025.03,959.3,0.0
256,8192,3072,1536,0,0,66.4578,a8w8_blockscale_1x128x128_256x128x128x128_16x16_32x32_8x32x1_8x32x1_1x32x1x8_8_1x1_intrawave_v3,1163.29,1017.69,0.0
256,16384,3072,1536,0,0,125.1134,a8w8_blockscale_1x128x128_256x128x128x128_16x16_32x32_8x32x1_8x32x1_1x32x1x8_8_1x1_intrawave_v3,1235.83,1043.44,0.0
256,20480,3072,1536,0,0,223.3253,a8w8_blockscale_1x128x128_256x128x128x128_16x16_32x32_8x32x1_8x32x1_1x32x1x8_8_1x1_intrawave_v3,865.43,725.42,0.0
256,32768,3072,1536,0,0,227.0388,a8w8_blockscale_1x128x128_256x128x128x128_16x16_32x32_8x32x1_8x32x1_1x32x1x8_8_1x1_intrawave_v3,1362.05,1129.22,0.0
256,1,4096,512,8,0,3.8518,a8w8_blockscale_1x128x128_256x16x64x256_16x16_16x16_16x16x1_16x16x1_1x16x1x16_4_1x1_intrawave_v1,1.09,546.72,0.0
256,2,4096,512,8,0,3.8129,a8w8_blockscale_1x128x128_256x16x64x256_16x16_16x16_16x16x1_16x16x1_1x16x1x16_4_1x1_intrawave_v1,2.2,554.58,0.0
256,4,4096,512,13,0,3.4246,a8w8_blockscale_1x128x128_256x32x64x256_16x16_16x16_16x16x1_16x16x1_1x32x1x8_8_2x1_intrawave_v1,4.9,622.55,0.0
256,8,4096,512,8,0,3.8517,a8w8_blockscale_1x128x128_256x16x64x256_16x16_16x16_16x16x1_16x16x1_1x16x1x16_4_1x1_intrawave_v1,8.71,562.55,0.0
256,16,4096,512,8,0,3.835,a8w8_blockscale_1x128x128_256x16x64x256_16x16_16x16_16x16x1_16x16x1_1x16x1x16_4_1x1_intrawave_v1,17.5,583.16,0.0
256,32,4096,512,11,0,3.8544,a8w8_blockscale_1x128x128_256x32x64x128_16x16_16x16_8x32x1_8x32x1_1x32x1x8_8_2x1_intrawave_v1,34.82,616.36,0.0
256,64,4096,512,6,0,4.0748,a8w8_blockscale_1x128x128_256x16x64x128_8x16_16x16_16x16x1_8x32x1_1x16x1x16_4_1x1_intrawave_v1,65.88,651.37,0.0
256,128,4096,512,11,0,4.4446,a8w8_blockscale_1x128x128_256x32x64x128_16x16_16x16_8x32x1_8x32x1_1x32x1x8_8_2x1_intrawave_v1,120.79,722.51,0.0
256,256,4096,512,12,0,4.6202,a8w8_blockscale_1x128x128_256x32x128x256_16x16_32x32_16x16x1_16x16x1_1x32x1x8_8_1x1_intrawave_v1,232.4,936.19,0.0
256,512,4096,512,18,0,7.2254,a8w8_blockscale_1x128x128_256x64x64x256_16x16_32x32_16x16x1_16x16x1_1x32x1x8_8_1x1_intrawave_v1,297.21,907.02,0.0
256,1024,4096,512,0,0,9.5064,a8w8_blockscale_1x128x128_256x128x128x128_16x16_32x32_8x32x1_8x32x1_1x32x1x8_8_1x1_intrawave_v3,451.8,1158.17,0.0
256,2048,4096,512,0,0,14.9624,a8w8_blockscale_1x128x128_256x128x128x128_16x16_32x32_8x32x1_8x32x1_1x32x1x8_8_1x1_intrawave_v3,574.1,1331.53,0.0
256,4096,4096,512,0,0,25.9147,a8w8_blockscale_1x128x128_256x128x128x128_16x16_32x32_8x32x1_8x32x1_1x32x1x8_8_1x1_intrawave_v3,662.94,1456.65,0.0
256,8192,4096,512,0,0,45.4707,a8w8_blockscale_1x128x128_256x128x128x128_16x16_32x32_8x32x1_8x32x1_1x32x1x8_8_1x1_intrawave_v3,755.65,1614.23,0.0
256,16384,4096,512,0,0,85.3201,a8w8_blockscale_1x128x128_256x128x128x128_16x16_32x32_8x32x1_8x32x1_1x32x1x8_8_1x1_intrawave_v3,805.43,1696.01,0.0
256,20480,4096,512,18,0,144.807,a8w8_blockscale_1x128x128_256x64x64x256_16x16_32x32_16x16x1_16x16x1_1x32x1x8_8_1x1_intrawave_v1,593.2,1245.49,0.0
256,32768,4096,512,0,0,159.2565,a8w8_blockscale_1x128x128_256x128x128x128_16x16_32x32_8x32x1_8x32x1_1x32x1x8_8_1x1_intrawave_v3,863.0,1804.07,0.0
256,1,7168,2048,8,0,8.5724,a8w8_blockscale_1x128x128_256x16x64x256_16x16_16x16_16x16x1_16x16x1_1x16x1x16_4_1x1_intrawave_v1,3.42,1714.39,0.0
256,2,7168,2048,8,0,8.6049,a8w8_blockscale_1x128x128_256x16x64x256_16x16_16x16_16x16x1_16x16x1_1x16x1x16_4_1x1_intrawave_v1,6.82,1709.82,0.0
256,4,7168,2048,8,0,8.188,a8w8_blockscale_1x128x128_256x16x64x256_16x16_16x16_16x16x1_16x16x1_1x16x1x16_4_1x1_intrawave_v1,14.34,1800.88,0.0
256,8,7168,2048,8,0,8.3523,a8w8_blockscale_1x128x128_256x16x64x256_16x16_16x16_16x16x1_16x16x1_1x16x1x16_4_1x1_intrawave_v1,28.12,1773.3,0.0
256,16,7168,2048,8,0,8.3043,a8w8_blockscale_1x128x128_256x16x64x256_16x16_16x16_16x16x1_16x16x1_1x16x1x16_4_1x1_intrawave_v1,56.57,1799.33,0.0
256,32,7168,2048,7,0,8.4862,a8w8_blockscale_1x128x128_256x16x128x256_16x16_16x16_16x16x1_16x16x1_1x16x1x16_8_1x2_intrawave_v1,110.71,1791.66,0.0
256,64,7168,2048,8,0,8.825,a8w8_blockscale_1x128x128_256x16x64x256_16x16_16x16_16x16x1_16x16x1_1x16x1x16_4_1x1_intrawave_v1,212.92,1782.28,0.0
256,128,7168,2048,18,0,9.0903,a8w8_blockscale_1x128x128_256x64x64x256_16x16_32x32_16x16x1_16x16x1_1x32x1x8_8_1x1_intrawave_v1,413.42,1845.62,0.0
256,256,7168,2048,18,0,13.0936,a8w8_blockscale_1x128x128_256x64x64x256_16x16_32x32_16x16x1_16x16x1_1x32x1x8_8_1x1_intrawave_v1,574.04,1441.5,0.0
256,512,7168,2048,0,0,19.376,a8w8_blockscale_1x128x128_256x128x128x128_16x16_32x32_8x32x1_8x32x1_1x32x1x8_8_1x1_intrawave_v3,775.83,1190.58,0.0
256,1024,7168,2048,0,0,31.2424,a8w8_blockscale_1x128x128_256x128x128x128_16x16_32x32_8x32x1_8x32x1_1x32x1x8_8_1x1_intrawave_v3,962.31,1006.88,0.0
256,2048,7168,2048,0,0,56.3503,a8w8_blockscale_1x128x128_256x128x128x128_16x16_32x32_8x32x1_8x32x1_1x32x1x8_8_1x1_intrawave_v3,1067.07,855.98,0.0
256,4096,7168,2048,0,0,98.6453,a8w8_blockscale_1x128x128_256x128x128x128_16x16_32x32_8x32x1_8x32x1_1x32x1x8_8_1x1_intrawave_v3,1219.11,829.12,0.0
256,8192,7168,2048,0,0,178.4711,a8w8_blockscale_1x128x128_256x128x128x128_16x16_32x32_8x32x1_8x32x1_1x32x1x8_8_1x1_intrawave_v3,1347.66,834.3,0.0
256,16384,7168,2048,0,0,330.8182,a8w8_blockscale_1x128x128_256x128x128x128_16x16_32x32_8x32x1_8x32x1_1x32x1x8_8_1x1_intrawave_v3,1454.08,855.8,0.0
256,20480,7168,2048,0,0,630.5854,a8w8_blockscale_1x128x128_256x128x128x128_16x16_32x32_8x32x1_8x32x1_1x32x1x8_8_1x1_intrawave_v3,953.55,555.4,0.0
256,32768,7168,2048,0,0,649.7976,a8w8_blockscale_1x128x128_256x128x128x128_16x16_32x32_8x32x1_8x32x1_1x32x1x8_8_1x1_intrawave_v3,1480.57,848.8,0.0
